mysql> create database AddressBookService;
Query OK, 1 row affected (0.09 sec)

mysql> show databases;
+--------------------+
| Database           |
+--------------------+
| addressbookservice |
| information_schema |
| mysql              |
| payrollservice     |
| performance_schema |
| sys                |
+--------------------+
6 rows in set (0.00 sec)

mysql> use addressbookservice;
Database changed;
mysql> create table addressbook(First_name varchar(30),Last_name varchar(20),Address varchar(20),City varchar(30),State varchar(20),Phonenumber int,Zipcode int,Email varchar(20));
Query OK, 0 rows affected (0.12 sec)

mysql> desc addressbook;
+-------------+-------------+------+-----+---------+-------+
| Field       | Type        | Null | Key | Default | Extra |
+-------------+-------------+------+-----+---------+-------+
| First_name  | varchar(30) | YES  |     | NULL    |       |
| Last_name   | varchar(20) | YES  |     | NULL    |       |
| Address     | varchar(20) | YES  |     | NULL    |       |
| City        | varchar(30) | YES  |     | NULL    |       |
| State       | varchar(20) | YES  |     | NULL    |       |
| Phonenumber | int         | YES  |     | NULL    |       |
| Zipcode     | int         | YES  |     | NULL    |       |
| Email       | varchar(20) | YES  |     | NULL    |       |
+-------------+-------------+------+-----+---------+-------+
8 rows in set (0.06 sec)

mysql> insert into addressbook values('Ramaknat','Dada','Hubbli','Borgon','Karnatak',98987745,7474,'daad@123gmail.com');
Query OK, 1 row affected (0.09 sec)

mysql> insert into addressbook values('Rohan','Dada','belgavi','mapsa','goa',9899095,7074,'ad@123gmail.com');
Query OK, 1 row affected (0.14 sec)

mysql> insert into addressbook values('Roshan','Dada','belgavi','ankali','maharatsra',90999095,7098,'rd@123gmail.com');
Query OK, 1 row affected (0.04 sec)

mysql> select * from addressbook;
+------------+-----------+---------+--------+------------+-------------+---------+-------------------+
| First_name | Last_name | Address | City   | State      | Phonenumber | Zipcode | Email             |
+------------+-----------+---------+--------+------------+-------------+---------+-------------------+
| Ramaknat   | Dada      | Hubbli  | Borgon | Karnatak   |    98987745 |    7474 | daad@123gmail.com |
| Rohan      | Dada      | belgavi | mapsa  | goa        |     9899095 |    7074 | ad@123gmail.com   |
| Roshan     | Dada      | belgavi | ankali | maharatsra |    90999095 |    7098 | rd@123gmail.com   |
+------------+-----------+---------+--------+------------+-------------+---------+-------------------+
3 rows in set (0.00 sec)

mysql> update addressbook set Phonenumber='668877667' where State='goa';
Query OK, 1 row affected (0.09 sec)
Rows matched: 1  Changed: 1  Warnings: 0

mysql> select * from addressbook;
+------------+-----------+---------+--------+------------+-------------+---------+-------------------+
| First_name | Last_name | Address | City   | State      | Phonenumber | Zipcode | Email             |
+------------+-----------+---------+--------+------------+-------------+---------+-------------------+
| Ramaknat   | Dada      | Hubbli  | Borgon | Karnatak   |    98987745 |    7474 | daad@123gmail.com |
| Rohan      | Dada      | belgavi | mapsa  | goa        |   668877667 |    7074 | ad@123gmail.com   |
| Roshan     | Dada      | belgavi | ankali | maharatsra |    90999095 |    7098 | rd@123gmail.com   |
+------------+-----------+---------+--------+------------+-------------+---------+-------------------+
3 rows in set (0.00 sec)

mysql> delete from addressbook where State='goa';
Query OK, 1 row affected (0.17 sec)

mysql> select * from addressbook;
+------------+-----------+---------+--------+------------+-------------+---------+-------------------+
| First_name | Last_name | Address | City   | State      | Phonenumber | Zipcode | Email             |
+------------+-----------+---------+--------+------------+-------------+---------+-------------------+
| Ramaknat   | Dada      | Hubbli  | Borgon | Karnatak   |    98987745 |    7474 | daad@123gmail.com |
| Roshan     | Dada      | belgavi | ankali | maharatsra |    90999095 |    7098 | rd@123gmail.com   |
+------------+-----------+---------+--------+------------+-------------+---------+-------------------+
2 rows in set (0.00 sec)


mysql> select * from addressbook where City='Borgon';
+------------+-----------+---------+--------+----------+-------------+---------+-------------------+
| First_name | Last_name | Address | City   | State    | Phonenumber | Zipcode | Email             |
+------------+-----------+---------+--------+----------+-------------+---------+-------------------+
| Ramaknat   | Dada      | Hubbli  | Borgon | Karnatak |    98987745 |    7474 | daad@123gmail.com |
+------------+-----------+---------+--------+----------+-------------+---------+-------------------+
1 row in set (0.00 sec)

mysql> select * from addressbook where City='ankali';
+------------+-----------+---------+--------+------------+-------------+---------+-----------------+
| First_name | Last_name | Address | City   | State      | Phonenumber | Zipcode | Email           |
+------------+-----------+---------+--------+------------+-------------+---------+-----------------+
| Roshan     | Dada      | belgavi | ankali | maharatsra |    90999095 |    7098 | rd@123gmail.com |
+------------+-----------+---------+--------+------------+-------------+---------+-----------------+
1 row in set (0.00 sec)